{
  "axis": "speed-throughput",
  "schemaVersion": "1.0.0",
  "environment": {
    "capturedAt": "2026-05-17T16:10:18.354Z",
    "gitSha": "1ad1b79c",
    "gitDirty": true,
    "nodeVersion": "v20.19.6",
    "os": "darwin 25.3.0",
    "arch": "arm64",
    "cpuModel": "Apple M5",
    "cpuCount": 10,
    "totalMemoryBytes": 17179869184,
    "chromeVersion": "Google Chrome 148.0.7778.168",
    "networkProfile": "unthrottled"
  },
  "competitors": [
    {
      "name": "OpenChrome",
      "version": "1.12.4"
    },
    {
      "name": "Crawlee",
      "version": "3.16.0"
    }
  ],
  "tokenizer": "cl100k_base",
  "results": [
    {
      "library": "OpenChrome",
      "mode": "dom-stub",
      "sessionMode": "reuse",
      "concurrency": 1,
      "pagesPerPass": 50,
      "sampleCount": 3,
      "warmupDiscarded": 3,
      "rawPagesPerSecond": 150000,
      "successRate": 1,
      "effectivePagesPerSecond": 150000,
      "meanWallMs": 0.3333333333333333,
      "p50WallMs": 0,
      "p95WallMs": 1
    },
    {
      "library": "OpenChrome",
      "mode": "dom-stub",
      "sessionMode": "reuse",
      "concurrency": 5,
      "pagesPerPass": 50,
      "sampleCount": 3,
      "warmupDiscarded": 3,
      "rawPagesPerSecond": 0,
      "successRate": 1,
      "effectivePagesPerSecond": 0,
      "meanWallMs": 0,
      "p50WallMs": 0,
      "p95WallMs": 0
    },
    {
      "library": "OpenChrome",
      "mode": "dom-stub",
      "sessionMode": "reuse",
      "concurrency": 10,
      "pagesPerPass": 50,
      "sampleCount": 3,
      "warmupDiscarded": 3,
      "rawPagesPerSecond": 150000,
      "successRate": 1,
      "effectivePagesPerSecond": 150000,
      "meanWallMs": 0.3333333333333333,
      "p50WallMs": 0,
      "p95WallMs": 1
    },
    {
      "library": "OpenChrome",
      "mode": "dom-stub",
      "sessionMode": "reuse",
      "concurrency": 20,
      "pagesPerPass": 50,
      "sampleCount": 3,
      "warmupDiscarded": 3,
      "rawPagesPerSecond": 150000,
      "successRate": 1,
      "effectivePagesPerSecond": 150000,
      "meanWallMs": 0.3333333333333333,
      "p50WallMs": 0,
      "p95WallMs": 1
    },
    {
      "library": "OpenChrome",
      "mode": "dom-stub",
      "sessionMode": "cold",
      "concurrency": 1,
      "pagesPerPass": 50,
      "sampleCount": 3,
      "warmupDiscarded": 3,
      "rawPagesPerSecond": 150000,
      "successRate": 1,
      "effectivePagesPerSecond": 150000,
      "meanWallMs": 0.3333333333333333,
      "p50WallMs": 0,
      "p95WallMs": 1
    },
    {
      "library": "OpenChrome",
      "mode": "dom-stub",
      "sessionMode": "cold",
      "concurrency": 5,
      "pagesPerPass": 50,
      "sampleCount": 3,
      "warmupDiscarded": 3,
      "rawPagesPerSecond": 0,
      "successRate": 1,
      "effectivePagesPerSecond": 0,
      "meanWallMs": 0,
      "p50WallMs": 0,
      "p95WallMs": 0
    },
    {
      "library": "OpenChrome",
      "mode": "dom-stub",
      "sessionMode": "cold",
      "concurrency": 10,
      "pagesPerPass": 50,
      "sampleCount": 3,
      "warmupDiscarded": 3,
      "rawPagesPerSecond": 0,
      "successRate": 1,
      "effectivePagesPerSecond": 0,
      "meanWallMs": 0,
      "p50WallMs": 0,
      "p95WallMs": 0
    },
    {
      "library": "OpenChrome",
      "mode": "dom-stub",
      "sessionMode": "cold",
      "concurrency": 20,
      "pagesPerPass": 50,
      "sampleCount": 3,
      "warmupDiscarded": 3,
      "rawPagesPerSecond": 150000,
      "successRate": 1,
      "effectivePagesPerSecond": 150000,
      "meanWallMs": 0.3333333333333333,
      "p50WallMs": 0,
      "p95WallMs": 1
    },
    {
      "library": "Crawlee",
      "mode": "cheerio-text",
      "sessionMode": "reuse",
      "concurrency": 1,
      "pagesPerPass": 50,
      "sampleCount": 3,
      "warmupDiscarded": 3,
      "rawPagesPerSecond": 688.0733944954128,
      "successRate": 1,
      "effectivePagesPerSecond": 688.0733944954128,
      "meanWallMs": 72.66666666666667,
      "p50WallMs": 49,
      "p95WallMs": 132
    },
    {
      "library": "Crawlee",
      "mode": "cheerio-text",
      "sessionMode": "reuse",
      "concurrency": 5,
      "pagesPerPass": 50,
      "sampleCount": 3,
      "warmupDiscarded": 3,
      "rawPagesPerSecond": 306.12244897959187,
      "successRate": 1,
      "effectivePagesPerSecond": 306.12244897959187,
      "meanWallMs": 163.33333333333334,
      "p50WallMs": 76,
      "p95WallMs": 346
    },
    {
      "library": "Crawlee",
      "mode": "cheerio-text",
      "sessionMode": "reuse",
      "concurrency": 10,
      "pagesPerPass": 50,
      "sampleCount": 3,
      "warmupDiscarded": 3,
      "rawPagesPerSecond": 309.27835051546396,
      "successRate": 1,
      "effectivePagesPerSecond": 309.27835051546396,
      "meanWallMs": 161.66666666666666,
      "p50WallMs": 66,
      "p95WallMs": 364
    },
    {
      "library": "Crawlee",
      "mode": "cheerio-text",
      "sessionMode": "reuse",
      "concurrency": 20,
      "pagesPerPass": 50,
      "sampleCount": 3,
      "warmupDiscarded": 3,
      "rawPagesPerSecond": 675.6756756756756,
      "successRate": 1,
      "effectivePagesPerSecond": 675.6756756756756,
      "meanWallMs": 74,
      "p50WallMs": 53,
      "p95WallMs": 117
    },
    {
      "library": "Crawlee",
      "mode": "cheerio-text",
      "sessionMode": "cold",
      "concurrency": 1,
      "pagesPerPass": 50,
      "sampleCount": 3,
      "warmupDiscarded": 3,
      "rawPagesPerSecond": 307.3770491803279,
      "successRate": 1,
      "effectivePagesPerSecond": 307.3770491803279,
      "meanWallMs": 162.66666666666666,
      "p50WallMs": 132,
      "p95WallMs": 306
    },
    {
      "library": "Crawlee",
      "mode": "cheerio-text",
      "sessionMode": "cold",
      "concurrency": 5,
      "pagesPerPass": 50,
      "sampleCount": 3,
      "warmupDiscarded": 3,
      "rawPagesPerSecond": 2000,
      "successRate": 1,
      "effectivePagesPerSecond": 2000,
      "meanWallMs": 25,
      "p50WallMs": 25,
      "p95WallMs": 26
    },
    {
      "library": "Crawlee",
      "mode": "cheerio-text",
      "sessionMode": "cold",
      "concurrency": 10,
      "pagesPerPass": 50,
      "sampleCount": 3,
      "warmupDiscarded": 3,
      "rawPagesPerSecond": 1500,
      "successRate": 1,
      "effectivePagesPerSecond": 1500,
      "meanWallMs": 33.333333333333336,
      "p50WallMs": 33,
      "p95WallMs": 36
    },
    {
      "library": "Crawlee",
      "mode": "cheerio-text",
      "sessionMode": "cold",
      "concurrency": 20,
      "pagesPerPass": 50,
      "sampleCount": 3,
      "warmupDiscarded": 3,
      "rawPagesPerSecond": 1219.5121951219512,
      "successRate": 1,
      "effectivePagesPerSecond": 1219.5121951219512,
      "meanWallMs": 41,
      "p50WallMs": 42,
      "p95WallMs": 43
    }
  ]
}
