{
  "axis": "realworld-task-completion",
  "schemaVersion": "1.0.0",
  "environment": {
    "capturedAt": "2026-05-16T17:01:41.662Z",
    "gitSha": "26c4ce33",
    "gitDirty": true,
    "nodeVersion": "v20.19.6",
    "os": "darwin 25.3.0",
    "arch": "arm64",
    "cpuModel": "Apple M5",
    "cpuCount": 10,
    "totalMemoryBytes": 17179869184,
    "chromeVersion": "Google Chrome 148.0.7778.168",
    "networkProfile": "unthrottled"
  },
  "competitors": [
    {
      "name": "openchrome",
      "version": "1.12.2"
    }
  ],
  "tokenizer": "cl100k_base",
  "results": [
    {
      "suite": "complex-real-world-task-completion",
      "issue": "#1305",
      "measurementMode": "deterministic-fixture",
      "claimScope": "scaffold-only; not a live competitive measurement",
      "tasks": [
        {
          "id": "rw-001-checkout-update-address",
          "title": "Update a checkout shipping address and verify recalculated summary",
          "tier": "local-fixture",
          "goal": "Find the checkout address form, update the shipping city/postal code, and verify the order summary reflects the new destination.",
          "maxSteps": 14,
          "successCriteria": [
            "address fields saved",
            "summary destination updated",
            "tax/shipping recalculated"
          ],
          "complexityTags": [
            "form-fill",
            "stateful-ui",
            "verification"
          ],
          "requiresRecovery": false
        },
        {
          "id": "rw-002-search-filter-compare",
          "title": "Search, filter, compare two products, and extract the cheaper eligible item",
          "tier": "local-fixture",
          "goal": "Search a product catalog, apply availability and rating filters, compare two candidates, and report the cheaper eligible item.",
          "maxSteps": 16,
          "successCriteria": [
            "filters applied",
            "two candidates compared",
            "eligible cheaper item extracted"
          ],
          "complexityTags": [
            "search",
            "filtering",
            "extraction",
            "decision"
          ],
          "requiresRecovery": false
        },
        {
          "id": "rw-003-tab-research-synthesis",
          "title": "Use multiple tabs to synthesize two reference pages into one answer",
          "tier": "stable-public-reference",
          "goal": "Open two reference pages, extract the requested facts from each, and produce a synthesized answer with both facts.",
          "maxSteps": 18,
          "successCriteria": [
            "two tabs used",
            "fact from page A extracted",
            "fact from page B extracted",
            "combined answer produced"
          ],
          "complexityTags": [
            "tabs",
            "reading",
            "synthesis"
          ],
          "requiresRecovery": false
        },
        {
          "id": "rw-004-selector-drift-recovery",
          "title": "Recover from selector drift while submitting a feedback form",
          "tier": "recovery",
          "goal": "Submit a feedback form after the primary submit selector changes during the run.",
          "maxSteps": 20,
          "successCriteria": [
            "selector failure observed",
            "fallback selector or semantic action used",
            "form submitted"
          ],
          "complexityTags": [
            "fault-recovery",
            "form-fill",
            "grounding"
          ],
          "requiresRecovery": true
        },
        {
          "id": "rw-005-long-horizon-itinerary",
          "title": "Build and verify a multi-step itinerary from constrained options",
          "tier": "long-horizon",
          "goal": "Filter itinerary options by date, budget, and transit time; add the best option; verify the final itinerary summary.",
          "maxSteps": 28,
          "successCriteria": [
            "constraints applied",
            "best option selected",
            "itinerary added",
            "summary verified"
          ],
          "complexityTags": [
            "long-horizon",
            "filtering",
            "decision",
            "stateful-ui"
          ],
          "requiresRecovery": false
        }
      ],
      "runs": [
        {
          "library": "openchrome",
          "taskId": "rw-001-checkout-update-address",
          "mode": "deterministic-fixture",
          "success": true,
          "firstAttempt": true,
          "recovered": null,
          "wallTimeMs": 1200,
          "toolCalls": 5,
          "retries": 0,
          "noProgressLoops": 0,
          "tokens": null,
          "usd": null,
          "failureCategory": "none",
          "notes": "deterministic scaffold row from local fixture contract; not a live competitive LLM/browser measurement"
        },
        {
          "library": "openchrome",
          "taskId": "rw-002-search-filter-compare",
          "mode": "deterministic-fixture",
          "success": true,
          "firstAttempt": true,
          "recovered": null,
          "wallTimeMs": 1375,
          "toolCalls": 7,
          "retries": 0,
          "noProgressLoops": 0,
          "tokens": null,
          "usd": null,
          "failureCategory": "none",
          "notes": "deterministic scaffold row from local fixture contract; not a live competitive LLM/browser measurement"
        },
        {
          "library": "openchrome",
          "taskId": "rw-003-tab-research-synthesis",
          "mode": "deterministic-fixture",
          "success": true,
          "firstAttempt": true,
          "recovered": null,
          "wallTimeMs": 1550,
          "toolCalls": 9,
          "retries": 0,
          "noProgressLoops": 0,
          "tokens": null,
          "usd": null,
          "failureCategory": "none",
          "notes": "deterministic scaffold row from local fixture contract; not a live competitive LLM/browser measurement"
        },
        {
          "library": "openchrome",
          "taskId": "rw-004-selector-drift-recovery",
          "mode": "deterministic-fixture",
          "success": true,
          "firstAttempt": false,
          "recovered": true,
          "wallTimeMs": 2175,
          "toolCalls": 14,
          "retries": 1,
          "noProgressLoops": 0,
          "tokens": null,
          "usd": null,
          "failureCategory": "none",
          "notes": "deterministic scaffold row from local fixture contract; not a live competitive LLM/browser measurement"
        },
        {
          "library": "openchrome",
          "taskId": "rw-005-long-horizon-itinerary",
          "mode": "deterministic-fixture",
          "success": true,
          "firstAttempt": true,
          "recovered": null,
          "wallTimeMs": 1900,
          "toolCalls": 13,
          "retries": 0,
          "noProgressLoops": 0,
          "tokens": null,
          "usd": null,
          "failureCategory": "none",
          "notes": "deterministic scaffold row from local fixture contract; not a live competitive LLM/browser measurement"
        }
      ],
      "metrics": [
        {
          "library": "openchrome",
          "mode": "deterministic-fixture",
          "totalRuns": 5,
          "successRate": 1,
          "firstAttemptSuccessRate": 0.8,
          "recoverySuccessRate": 1,
          "meanWallTimeMs": 1640,
          "p50WallTimeMs": 1550,
          "p95WallTimeMs": 2175,
          "meanToolCalls": 9.6,
          "meanRetries": 0.2,
          "meanNoProgressLoops": 0,
          "meanTokens": null,
          "costPerSuccessUsd": null
        }
      ],
      "claimEligibility": {
        "eligible": false,
        "tier": "diagnostic-only",
        "reasons": [
          "measurement mode scaffold is not headline-eligible; use live or recorded-real",
          "sample count 5 is below aggregate threshold N >= 10",
          "LLM model/settings/budgets are not pinned"
        ],
        "requiredSamples": 10
      }
    }
  ]
}
